<?xml version="1.0"?>
<!DOCTYPE config SYSTEM "config.dtd">
<config>
  <log level="debug"/>
  <update rate="10"/>
  <domain name="amo.vyncke.org"/>
  <rules>
    <rule src-address="2001:db8:0:85a3::ac1f:8001" src-mask="12" name=".*Room.*" type=".*" router="london">allow</rule>
    <rule src-address="2015:db8:0:85a3::ac1f:8001" src-mask="22" name=".*Desk.*" type=".*" router="brussels">allow</rule>
    <rule src-address="1993:db8:0:85a3::ac1f:8001" src-mask="11" name=".*" type=".*" router="*">deny</rule>
  </rules>
</config>
